<!ELEMENT agile_principles_assessment (id,created_at,updated_at,deleted_at,respondent_id,status,is_anonymous,assessment_date,assessment_period,p01_customer_satisfaction,p01_comment,p01_weight,p02_welcome_change,p02_comment,p02_weight,p03_deliver_frequently,p03_comment,p03_weight,p04_collaboration,p04_comment,p04_weight,p05_motivated_individuals,p05_comment,p05_weight,p06_face_to_face,p06_comment,p06_weight,p07_working_software,p07_comment,p07_weight,p08_sustainable_development,p08_comment,p08_weight,p09_technical_excellence,p09_comment,p09_weight,p10_simplicity,p10_comment,p10_weight,p11_self_organising_teams,p11_comment,p11_weight,p12_regular_reflection,p12_comment,p12_weight,overall_notes)>
<!ELEMENT id (#PCDATA)>
<!ELEMENT created_at (#PCDATA)>
<!ELEMENT updated_at (#PCDATA)>
<!ELEMENT deleted_at (#PCDATA)>
<!ELEMENT respondent_id (#PCDATA)>
<!ELEMENT status (#PCDATA)>
<!ELEMENT is_anonymous (#PCDATA)>
<!ELEMENT assessment_date (#PCDATA)>
<!ELEMENT assessment_period (#PCDATA)>
<!ELEMENT p01_customer_satisfaction (#PCDATA)>
<!ELEMENT p01_comment (#PCDATA)>
<!ELEMENT p01_weight (#PCDATA)>
<!ELEMENT p02_welcome_change (#PCDATA)>
<!ELEMENT p02_comment (#PCDATA)>
<!ELEMENT p02_weight (#PCDATA)>
<!ELEMENT p03_deliver_frequently (#PCDATA)>
<!ELEMENT p03_comment (#PCDATA)>
<!ELEMENT p03_weight (#PCDATA)>
<!ELEMENT p04_collaboration (#PCDATA)>
<!ELEMENT p04_comment (#PCDATA)>
<!ELEMENT p04_weight (#PCDATA)>
<!ELEMENT p05_motivated_individuals (#PCDATA)>
<!ELEMENT p05_comment (#PCDATA)>
<!ELEMENT p05_weight (#PCDATA)>
<!ELEMENT p06_face_to_face (#PCDATA)>
<!ELEMENT p06_comment (#PCDATA)>
<!ELEMENT p06_weight (#PCDATA)>
<!ELEMENT p07_working_software (#PCDATA)>
<!ELEMENT p07_comment (#PCDATA)>
<!ELEMENT p07_weight (#PCDATA)>
<!ELEMENT p08_sustainable_development (#PCDATA)>
<!ELEMENT p08_comment (#PCDATA)>
<!ELEMENT p08_weight (#PCDATA)>
<!ELEMENT p09_technical_excellence (#PCDATA)>
<!ELEMENT p09_comment (#PCDATA)>
<!ELEMENT p09_weight (#PCDATA)>
<!ELEMENT p10_simplicity (#PCDATA)>
<!ELEMENT p10_comment (#PCDATA)>
<!ELEMENT p10_weight (#PCDATA)>
<!ELEMENT p11_self_organising_teams (#PCDATA)>
<!ELEMENT p11_comment (#PCDATA)>
<!ELEMENT p11_weight (#PCDATA)>
<!ELEMENT p12_regular_reflection (#PCDATA)>
<!ELEMENT p12_comment (#PCDATA)>
<!ELEMENT p12_weight (#PCDATA)>
<!ELEMENT overall_notes (#PCDATA)>
